[
  {
    "状态ID": "SCN-G08-00-S0",
    "场景ID": "SCN-G08-00",
    "状态码": "S0",
    "状态名称": "初始",
    "进入条件": "由前置变量判断",
    "状态效果": "切换热点、NPC、环境和地图节点",
    "存档规则": "S0/S2/S5/S6持久保存"
  },
  {
    "状态ID": "SCN-G08-00-S1",
    "场景ID": "SCN-G08-00",
    "状态码": "S1",
    "状态名称": "已调查",
    "进入条件": "由前置变量判断",
    "状态效果": "切换热点、NPC、环境和地图节点",
    "存档规则": "临时状态"
  },
  {
    "状态ID": "SCN-G08-00-S2",
    "场景ID": "SCN-G08-00",
    "状态码": "S2",
    "状态名称": "关键道具取得",
    "进入条件": "由前置变量判断",
    "状态效果": "切换热点、NPC、环境和地图节点",
    "存档规则": "S0/S2/S5/S6持久保存"
  },
  {
    "状态ID": "SCN-G08-00-S3",
    "场景ID": "SCN-G08-00",
    "状态码": "S3",
    "状态名称": "机关处理中",
    "进入条件": "由前置变量判断",
    "状态效果": "切换热点、NPC、环境和地图节点",
    "存档规则": "临时状态"
  },
  {
    "状态ID": "SCN-G08-00-S4",
    "场景ID": "SCN-G08-00",
    "状态码": "S4",
    "状态名称": "危险解除",
    "进入条件": "由前置变量判断",
    "状态效果": "切换热点、NPC、环境和地图节点",
    "存档规则": "临时状态"
  },
  {
    "状态ID": "SCN-G08-00-S5",
    "场景ID": "SCN-G08-00",
    "状态码": "S5",
    "状态名称": "场景修复",
    "进入条件": "由前置变量判断",
    "状态效果": "切换热点、NPC、环境和地图节点",
    "存档规则": "S0/S2/S5/S6持久保存"
  },
  {
    "状态ID": "SCN-G08-01-S0",
    "场景ID": "SCN-G08-01",
    "状态码": "S0",
    "状态名称": "初始",
    "进入条件": "由前置变量判断",
    "状态效果": "切换热点、NPC、环境和地图节点",
    "存档规则": "S0/S2/S5/S6持久保存"
  },
  {
    "状态ID": "SCN-G08-01-S1",
    "场景ID": "SCN-G08-01",
    "状态码": "S1",
    "状态名称": "已调查",
    "进入条件": "由前置变量判断",
    "状态效果": "切换热点、NPC、环境和地图节点",
    "存档规则": "临时状态"
  },
  {
    "状态ID": "SCN-G08-01-S2",
    "场景ID": "SCN-G08-01",
    "状态码": "S2",
    "状态名称": "关键道具取得",
    "进入条件": "由前置变量判断",
    "状态效果": "切换热点、NPC、环境和地图节点",
    "存档规则": "S0/S2/S5/S6持久保存"
  },
  {
    "状态ID": "SCN-G08-01-S3",
    "场景ID": "SCN-G08-01",
    "状态码": "S3",
    "状态名称": "机关处理中",
    "进入条件": "由前置变量判断",
    "状态效果": "切换热点、NPC、环境和地图节点",
    "存档规则": "临时状态"
  },
  {
    "状态ID": "SCN-G08-01-S4",
    "场景ID": "SCN-G08-01",
    "状态码": "S4",
    "状态名称": "危险解除",
    "进入条件": "由前置变量判断",
    "状态效果": "切换热点、NPC、环境和地图节点",
    "存档规则": "临时状态"
  },
  {
    "状态ID": "SCN-G08-01-S5",
    "场景ID": "SCN-G08-01",
    "状态码": "S5",
    "状态名称": "场景修复",
    "进入条件": "由前置变量判断",
    "状态效果": "切换热点、NPC、环境和地图节点",
    "存档规则": "S0/S2/S5/S6持久保存"
  },
  {
    "状态ID": "SCN-G08-01-S6",
    "场景ID": "SCN-G08-01",
    "状态码": "S6",
    "状态名称": "章节完成回访",
    "进入条件": "由前置变量判断",
    "状态效果": "切换热点、NPC、环境和地图节点",
    "存档规则": "S0/S2/S5/S6持久保存"
  },
  {
    "状态ID": "SCN-G08-02-S0",
    "场景ID": "SCN-G08-02",
    "状态码": "S0",
    "状态名称": "初始",
    "进入条件": "由前置变量判断",
    "状态效果": "切换热点、NPC、环境和地图节点",
    "存档规则": "S0/S2/S5/S6持久保存"
  },
  {
    "状态ID": "SCN-G08-02-S1",
    "场景ID": "SCN-G08-02",
    "状态码": "S1",
    "状态名称": "已调查",
    "进入条件": "由前置变量判断",
    "状态效果": "切换热点、NPC、环境和地图节点",
    "存档规则": "临时状态"
  },
  {
    "状态ID": "SCN-G08-02-S2",
    "场景ID": "SCN-G08-02",
    "状态码": "S2",
    "状态名称": "关键道具取得",
    "进入条件": "由前置变量判断",
    "状态效果": "切换热点、NPC、环境和地图节点",
    "存档规则": "S0/S2/S5/S6持久保存"
  },
  {
    "状态ID": "SCN-G08-02-S3",
    "场景ID": "SCN-G08-02",
    "状态码": "S3",
    "状态名称": "机关处理中",
    "进入条件": "由前置变量判断",
    "状态效果": "切换热点、NPC、环境和地图节点",
    "存档规则": "临时状态"
  },
  {
    "状态ID": "SCN-G08-02-S4",
    "场景ID": "SCN-G08-02",
    "状态码": "S4",
    "状态名称": "危险解除",
    "进入条件": "由前置变量判断",
    "状态效果": "切换热点、NPC、环境和地图节点",
    "存档规则": "临时状态"
  },
  {
    "状态ID": "SCN-G08-02-S5",
    "场景ID": "SCN-G08-02",
    "状态码": "S5",
    "状态名称": "场景修复",
    "进入条件": "由前置变量判断",
    "状态效果": "切换热点、NPC、环境和地图节点",
    "存档规则": "S0/S2/S5/S6持久保存"
  },
  {
    "状态ID": "SCN-G08-02-S6",
    "场景ID": "SCN-G08-02",
    "状态码": "S6",
    "状态名称": "章节完成回访",
    "进入条件": "由前置变量判断",
    "状态效果": "切换热点、NPC、环境和地图节点",
    "存档规则": "S0/S2/S5/S6持久保存"
  },
  {
    "状态ID": "SCN-G08-03-S0",
    "场景ID": "SCN-G08-03",
    "状态码": "S0",
    "状态名称": "初始",
    "进入条件": "由前置变量判断",
    "状态效果": "切换热点、NPC、环境和地图节点",
    "存档规则": "S0/S2/S5/S6持久保存"
  },
  {
    "状态ID": "SCN-G08-03-S1",
    "场景ID": "SCN-G08-03",
    "状态码": "S1",
    "状态名称": "已调查",
    "进入条件": "由前置变量判断",
    "状态效果": "切换热点、NPC、环境和地图节点",
    "存档规则": "临时状态"
  },
  {
    "状态ID": "SCN-G08-03-S2",
    "场景ID": "SCN-G08-03",
    "状态码": "S2",
    "状态名称": "关键道具取得",
    "进入条件": "由前置变量判断",
    "状态效果": "切换热点、NPC、环境和地图节点",
    "存档规则": "S0/S2/S5/S6持久保存"
  },
  {
    "状态ID": "SCN-G08-03-S3",
    "场景ID": "SCN-G08-03",
    "状态码": "S3",
    "状态名称": "机关处理中",
    "进入条件": "由前置变量判断",
    "状态效果": "切换热点、NPC、环境和地图节点",
    "存档规则": "临时状态"
  },
  {
    "状态ID": "SCN-G08-03-S4",
    "场景ID": "SCN-G08-03",
    "状态码": "S4",
    "状态名称": "危险解除",
    "进入条件": "由前置变量判断",
    "状态效果": "切换热点、NPC、环境和地图节点",
    "存档规则": "临时状态"
  },
  {
    "状态ID": "SCN-G08-03-S5",
    "场景ID": "SCN-G08-03",
    "状态码": "S5",
    "状态名称": "场景修复",
    "进入条件": "由前置变量判断",
    "状态效果": "切换热点、NPC、环境和地图节点",
    "存档规则": "S0/S2/S5/S6持久保存"
  },
  {
    "状态ID": "SCN-G08-03-S6",
    "场景ID": "SCN-G08-03",
    "状态码": "S6",
    "状态名称": "章节完成回访",
    "进入条件": "由前置变量判断",
    "状态效果": "切换热点、NPC、环境和地图节点",
    "存档规则": "S0/S2/S5/S6持久保存"
  },
  {
    "状态ID": "SCN-G08-04-S0",
    "场景ID": "SCN-G08-04",
    "状态码": "S0",
    "状态名称": "初始",
    "进入条件": "由前置变量判断",
    "状态效果": "切换热点、NPC、环境和地图节点",
    "存档规则": "S0/S2/S5/S6持久保存"
  },
  {
    "状态ID": "SCN-G08-04-S1",
    "场景ID": "SCN-G08-04",
    "状态码": "S1",
    "状态名称": "已调查",
    "进入条件": "由前置变量判断",
    "状态效果": "切换热点、NPC、环境和地图节点",
    "存档规则": "临时状态"
  },
  {
    "状态ID": "SCN-G08-04-S2",
    "场景ID": "SCN-G08-04",
    "状态码": "S2",
    "状态名称": "关键道具取得",
    "进入条件": "由前置变量判断",
    "状态效果": "切换热点、NPC、环境和地图节点",
    "存档规则": "S0/S2/S5/S6持久保存"
  },
  {
    "状态ID": "SCN-G08-04-S3",
    "场景ID": "SCN-G08-04",
    "状态码": "S3",
    "状态名称": "机关处理中",
    "进入条件": "由前置变量判断",
    "状态效果": "切换热点、NPC、环境和地图节点",
    "存档规则": "临时状态"
  },
  {
    "状态ID": "SCN-G08-04-S4",
    "场景ID": "SCN-G08-04",
    "状态码": "S4",
    "状态名称": "危险解除",
    "进入条件": "由前置变量判断",
    "状态效果": "切换热点、NPC、环境和地图节点",
    "存档规则": "临时状态"
  },
  {
    "状态ID": "SCN-G08-04-S5",
    "场景ID": "SCN-G08-04",
    "状态码": "S5",
    "状态名称": "场景修复",
    "进入条件": "由前置变量判断",
    "状态效果": "切换热点、NPC、环境和地图节点",
    "存档规则": "S0/S2/S5/S6持久保存"
  },
  {
    "状态ID": "SCN-G08-04-S6",
    "场景ID": "SCN-G08-04",
    "状态码": "S6",
    "状态名称": "章节完成回访",
    "进入条件": "由前置变量判断",
    "状态效果": "切换热点、NPC、环境和地图节点",
    "存档规则": "S0/S2/S5/S6持久保存"
  },
  {
    "状态ID": "SCN-G08-05-S0",
    "场景ID": "SCN-G08-05",
    "状态码": "S0",
    "状态名称": "初始",
    "进入条件": "由前置变量判断",
    "状态效果": "切换热点、NPC、环境和地图节点",
    "存档规则": "S0/S2/S5/S6持久保存"
  },
  {
    "状态ID": "SCN-G08-05-S1",
    "场景ID": "SCN-G08-05",
    "状态码": "S1",
    "状态名称": "已调查",
    "进入条件": "由前置变量判断",
    "状态效果": "切换热点、NPC、环境和地图节点",
    "存档规则": "临时状态"
  },
  {
    "状态ID": "SCN-G08-05-S2",
    "场景ID": "SCN-G08-05",
    "状态码": "S2",
    "状态名称": "关键道具取得",
    "进入条件": "由前置变量判断",
    "状态效果": "切换热点、NPC、环境和地图节点",
    "存档规则": "S0/S2/S5/S6持久保存"
  },
  {
    "状态ID": "SCN-G08-05-S3",
    "场景ID": "SCN-G08-05",
    "状态码": "S3",
    "状态名称": "机关处理中",
    "进入条件": "由前置变量判断",
    "状态效果": "切换热点、NPC、环境和地图节点",
    "存档规则": "临时状态"
  },
  {
    "状态ID": "SCN-G08-05-S4",
    "场景ID": "SCN-G08-05",
    "状态码": "S4",
    "状态名称": "危险解除",
    "进入条件": "由前置变量判断",
    "状态效果": "切换热点、NPC、环境和地图节点",
    "存档规则": "临时状态"
  },
  {
    "状态ID": "SCN-G08-05-S5",
    "场景ID": "SCN-G08-05",
    "状态码": "S5",
    "状态名称": "场景修复",
    "进入条件": "由前置变量判断",
    "状态效果": "切换热点、NPC、环境和地图节点",
    "存档规则": "S0/S2/S5/S6持久保存"
  },
  {
    "状态ID": "SCN-G08-05-S6",
    "场景ID": "SCN-G08-05",
    "状态码": "S6",
    "状态名称": "章节完成回访",
    "进入条件": "由前置变量判断",
    "状态效果": "切换热点、NPC、环境和地图节点",
    "存档规则": "S0/S2/S5/S6持久保存"
  },
  {
    "状态ID": "SCN-G08-06-S0",
    "场景ID": "SCN-G08-06",
    "状态码": "S0",
    "状态名称": "初始",
    "进入条件": "由前置变量判断",
    "状态效果": "切换热点、NPC、环境和地图节点",
    "存档规则": "S0/S2/S5/S6持久保存"
  },
  {
    "状态ID": "SCN-G08-06-S1",
    "场景ID": "SCN-G08-06",
    "状态码": "S1",
    "状态名称": "已调查",
    "进入条件": "由前置变量判断",
    "状态效果": "切换热点、NPC、环境和地图节点",
    "存档规则": "临时状态"
  },
  {
    "状态ID": "SCN-G08-06-S2",
    "场景ID": "SCN-G08-06",
    "状态码": "S2",
    "状态名称": "关键道具取得",
    "进入条件": "由前置变量判断",
    "状态效果": "切换热点、NPC、环境和地图节点",
    "存档规则": "S0/S2/S5/S6持久保存"
  },
  {
    "状态ID": "SCN-G08-06-S3",
    "场景ID": "SCN-G08-06",
    "状态码": "S3",
    "状态名称": "机关处理中",
    "进入条件": "由前置变量判断",
    "状态效果": "切换热点、NPC、环境和地图节点",
    "存档规则": "临时状态"
  },
  {
    "状态ID": "SCN-G08-06-S4",
    "场景ID": "SCN-G08-06",
    "状态码": "S4",
    "状态名称": "危险解除",
    "进入条件": "由前置变量判断",
    "状态效果": "切换热点、NPC、环境和地图节点",
    "存档规则": "临时状态"
  },
  {
    "状态ID": "SCN-G08-06-S5",
    "场景ID": "SCN-G08-06",
    "状态码": "S5",
    "状态名称": "场景修复",
    "进入条件": "由前置变量判断",
    "状态效果": "切换热点、NPC、环境和地图节点",
    "存档规则": "S0/S2/S5/S6持久保存"
  },
  {
    "状态ID": "SCN-G08-06-S6",
    "场景ID": "SCN-G08-06",
    "状态码": "S6",
    "状态名称": "章节完成回访",
    "进入条件": "由前置变量判断",
    "状态效果": "切换热点、NPC、环境和地图节点",
    "存档规则": "S0/S2/S5/S6持久保存"
  },
  {
    "状态ID": "SCN-G08-07-S0",
    "场景ID": "SCN-G08-07",
    "状态码": "S0",
    "状态名称": "初始",
    "进入条件": "由前置变量判断",
    "状态效果": "切换热点、NPC、环境和地图节点",
    "存档规则": "S0/S2/S5/S6持久保存"
  },
  {
    "状态ID": "SCN-G08-07-S1",
    "场景ID": "SCN-G08-07",
    "状态码": "S1",
    "状态名称": "已调查",
    "进入条件": "由前置变量判断",
    "状态效果": "切换热点、NPC、环境和地图节点",
    "存档规则": "临时状态"
  },
  {
    "状态ID": "SCN-G08-07-S2",
    "场景ID": "SCN-G08-07",
    "状态码": "S2",
    "状态名称": "关键道具取得",
    "进入条件": "由前置变量判断",
    "状态效果": "切换热点、NPC、环境和地图节点",
    "存档规则": "S0/S2/S5/S6持久保存"
  },
  {
    "状态ID": "SCN-G08-07-S3",
    "场景ID": "SCN-G08-07",
    "状态码": "S3",
    "状态名称": "机关处理中",
    "进入条件": "由前置变量判断",
    "状态效果": "切换热点、NPC、环境和地图节点",
    "存档规则": "临时状态"
  },
  {
    "状态ID": "SCN-G08-07-S4",
    "场景ID": "SCN-G08-07",
    "状态码": "S4",
    "状态名称": "危险解除",
    "进入条件": "由前置变量判断",
    "状态效果": "切换热点、NPC、环境和地图节点",
    "存档规则": "临时状态"
  },
  {
    "状态ID": "SCN-G08-07-S5",
    "场景ID": "SCN-G08-07",
    "状态码": "S5",
    "状态名称": "场景修复",
    "进入条件": "由前置变量判断",
    "状态效果": "切换热点、NPC、环境和地图节点",
    "存档规则": "S0/S2/S5/S6持久保存"
  },
  {
    "状态ID": "SCN-G08-07-S6",
    "场景ID": "SCN-G08-07",
    "状态码": "S6",
    "状态名称": "章节完成回访",
    "进入条件": "由前置变量判断",
    "状态效果": "切换热点、NPC、环境和地图节点",
    "存档规则": "S0/S2/S5/S6持久保存"
  },
  {